{
  "protocol": "hoh.protocol",
  "protocol_version": "2.0",
  "message_type": "critic.decision",
  "decision_id": "critic-approve-example",
  "bundle_id": "three-head-example-run",
  "bundle_sha256": "aaaaaaaaaaaaaaaaaaaaaaaaaaaaaaaaaaaaaaaaaaaaaaaaaaaaaaaaaaaaaaaa",
  "critic": {"identity": "external-critic", "kind": "agent"},
  "decision": "approve",
  "summary": "Acceptance criteria and immutable verification evidence are complete.",
  "findings": [],
  "correction_brief": null,
  "escalation": null,
  "created_at_utc": "2026-01-01T00:00:00+00:00",
  "attestation": {
    "reviewed_commit": "1111111111111111111111111111111111111111",
    "reviewed_patch_sha256": "bbbbbbbbbbbbbbbbbbbbbbbbbbbbbbbbbbbbbbbbbbbbbbbbbbbbbbbbbbbbbbbb"
  }
}
