{
  "protocol": "hoh.protocol",
  "protocol_version": "2.0",
  "message_type": "critic.decision",
  "decision_id": "critic-escalate-example",
  "bundle_id": "three-head-example-run",
  "bundle_sha256": "aaaaaaaaaaaaaaaaaaaaaaaaaaaaaaaaaaaaaaaaaaaaaaaaaaaaaaaaaaaaaaaa",
  "critic": {"identity": "external-critic", "kind": "agent"},
  "decision": "escalate",
  "summary": "The acceptance criteria permit two incompatible business behaviors.",
  "findings": [{"code": "AMBIGUOUS_REQUIREMENT", "severity": "blocker", "message": "The authoritative behavior cannot be inferred safely."}],
  "correction_brief": null,
  "escalation": {
    "reason": "A business decision is required.",
    "question": "Which behavior should be authoritative?",
    "options": ["реши сам", "stop", "свой"]
  },
  "created_at_utc": "2026-01-01T00:00:00+00:00",
  "attestation": {
    "reviewed_commit": "1111111111111111111111111111111111111111",
    "reviewed_patch_sha256": "bbbbbbbbbbbbbbbbbbbbbbbbbbbbbbbbbbbbbbbbbbbbbbbbbbbbbbbbbbbbbbbb"
  }
}
